Quantity,Price,Country,Description,Review,sentiment,sentiment_score,risk_level,customer_segment,churn_risk,satisfaction_score
3,19.03,United Kingdom,"High-Performance Gaming Mouse, adjustable DPI, 3 at $19.03.",This gaming mouse is a game-changer! Very precise and comfortable for long sessions. Worth every penny for serious gamers.,positive,0.95,low,premium,low,5
5,3.45,RSA,"Set of 5 Microfiber Cleaning Cloths, multi-purpose, $3.45.",These cleaning cloths are amazing! Super absorbent and leave no streaks. Perfect for kitchen and bathroom surfaces.,positive,0.9,low,budget_conscious,low,5
5,10.37,Austria,"Premium Stainless Steel Mixing Bowl, 5 available at $10.37.",Sturdy and well-made mixing bowl. A good size for baking and general kitchen use. Very happy with this purchase.,positive,0.8,low,premium,low,5
10,9.19,Cyprus,"Classic Ceramic Coffee Mug, 10 units in stock for $9.19.",Simple yet elegant coffee mug. Holds a good amount and feels comfortable to hold. A great addition to my kitchen.,positive,0.75,low,impulse_buyer,low,5
2,5.45,Austria,"Compact Travel Umbrella, windproof design, 2 left at $5.45.",This umbrella is surprisingly sturdy for its size. It's perfect to keep in my bag for unexpected rain showers. Good buy.,positive,0.7,low,budget_conscious,low,4
5,11.55,United Kingdom,"Handcrafted Leather Wallet, slim design, 5 pieces at $11.55.",Excellent quality leather wallet. It's slim but holds all my cards and cash perfectly. Very stylish and durable.,positive,0.9,low,premium,low,5
10,4.35,Greece,"Assorted Color Ballpoint Pens, smooth ink, 10 sets for $4.35.",Good variety of colors and they write smoothly. Perfect for school or office use. Great value for the price paid.,positive,0.8,low,budget_conscious,low,5
14,4.42,EIRE,"Eco-Friendly Reusable Shopping Bag, foldable, 14 at $4.42.","Love these reusable bags! They're sturdy, fold up small, and help reduce plastic waste. Essential for grocery runs.",positive,0.85,low,budget_conscious,low,5
7,0.08,Cyprus,"Tiny Decorative Buttons, mixed shapes, 7 packs for $0.08.","Can't believe the price for these cute buttons! Perfect for craft projects. A real bargain, highly recommend them.",positive,0.9,low,budget_conscious,low,5
2,3.52,Italy,"Adjustable Phone Stand, desk accessory, 2 units for $3.52.",Simple yet effective phone stand. Holds my phone securely at a good viewing angle. Great for video calls or watching videos.,positive,0.75,low,impulse_buyer,low,5
13,2.42,Switzerland,"Classic Wooden Clothes Hangers, durable, 13 pieces at $2.42.",These wooden hangers are much better than plastic ones. Sturdy and keep clothes from slipping. Good quality for the price.,positive,0.7,low,budget_conscious,low,4
28,2.19,EIRE,"Premium organic apples, 28 units @ $2.19 each.","Bought 28 apples at $2.19 each. They were crisp and delicious, perfect for snacks. Great value!",positive,0.9,low,bulk_buyer,low,5
-5,1.46,Netherlands,Return: 5 bottles of sparkling water @ $1.46/bottle.,"Returned 5 sparkling waters, each at $1.46, due to quality issues. Smooth return process.",negative,-0.4,high,return_prone,medium,2
7,2.32,Italy,"Freshly baked sourdough loaves, 7 units @ $2.32.","Purchased 7 loaves of sourdough at $2.32 each. Excellent taste and texture, highly recommend.",positive,0.9,low,bulk_buyer,low,5
6,3.13,United Kingdom,"Gourmet dark chocolate bars, 6 pieces @ $3.13.","The 6 chocolate bars at $3.13 each were a delightful treat. Rich flavor, perfect indulgence.",positive,0.9,low,premium,low,5
9,0.47,Channel Islands,"Packs of colorful sticky notes, 9 units @ $0.47.","Got 9 packs of sticky notes for $0.47 each. Super useful for work, good adhesive quality.",positive,0.8,low,budget_conscious,low,4
8,7.33,Spain,"High-performance AA batteries, 8-pack @ $7.33.",Needed 8 AA batteries; $7.33 for the pack was reasonable. They power my devices well.,positive,0.7,low,budget_conscious,low,4
14,1.57,France,"Cans of premium pet food, 14 units @ $1.57 per can.",My cat loves this food! Bought 14 cans at $1.57 each. Will definitely stock up again.,positive,0.9,low,bulk_buyer,low,5
8,13.19,United Arab Emirates,"Ergonomic computer mouse, 8 units @ $13.19 each.","Ordered 8 mice at $13.19 each for the office. Comfortable design, employees are happy.",positive,0.8,low,bulk_buyer,low,5
6,3.66,France,"Organic whole milk, 6 cartons @ $3.66 per carton.","Bought 6 cartons of milk, each for $3.66. Fresh and creamy, a staple in our household.",positive,0.8,low,bulk_buyer,low,5
12,13.56,Norway,"Wireless earbuds, 12 sets @ $13.56 per pair.",Purchased 12 sets of earbuds at $13.56. Sound quality is decent for the price point.,positive,0.6,low,bulk_buyer,low,4
0,11.12,Lithuania,"Consultation for a service, 0 quantity, priced $11.12.","Had a consultation, no purchase made. The service was quoted at $11.12, but I passed.",neutral,0.0,medium,budget_conscious,high,3
7,10.08,EIRE,"Stainless steel water bottles, 7 units @ $10.08.","The 7 water bottles, each $10.08, are great for the gym. Keeps drinks cold for hours.",positive,0.8,low,bulk_buyer,low,5
9,2.63,France,"Assorted greeting cards, 9 packs @ $2.63 each.",Stocked up on 9 packs of cards at $2.63 each. Good variety for all occasions.,positive,0.7,low,bulk_buyer,low,4
30,4.51,Sweden,"Bulk pack of microfiber cloths, 30 units @ $4.51.",Received 30 microfiber cloths for $4.51. They are very absorbent and lint-free. Excellent!,positive,0.9,low,bulk_buyer,low,5
13,0.09,Austria,"Small plastic storage bags, 13 packs @ $0.09 each.",Bought 13 packs of tiny storage bags at $0.09 each. Perfect for organizing small items.,positive,0.8,low,bulk_buyer,low,4
14,5.08,France,"Premium laundry detergent pods, 14 counts @ $5.08.",My clothes feel clean after using these 14 pods at $5.08. Good fragrance too.,positive,0.8,low,bulk_buyer,low,4
7,8.62,Channel Islands,"Children's storybooks, 7 copies @ $8.62 per book.",The 7 storybooks for $8.62 each are a hit with the kids. Engaging stories and illustrations.,positive,0.9,low,bulk_buyer,low,5
17,9.57,Cyprus,"Desk organizers, 17 units @ $9.57 each item.",Purchased 17 desk organizers at $9.57 each for the office. Helps keep everything tidy.,positive,0.7,low,bulk_buyer,low,4
1,2.35,Netherlands,"Single durable ballpoint pen, 1 unit @ $2.35.","Just one pen for $2.35, but it writes smoothly and feels sturdy. Worth the price.",positive,0.8,low,premium,low,4
11,1.04,Belgium,"Snack-size potato chips, 11 bags @ $1.04 each bag.",Grabbed 11 bags of chips at $1.04 each for a party. Everyone enjoyed the variety.,positive,0.8,low,bulk_buyer,low,4
1,6.14,Italy,Organic Coffee Beans (1 lb) for $6.14,"The coffee has a rich flavor, perfect for my morning routine. Great value at this price.",positive,0.8,low,budget_conscious,low,5
1,3.84,United Arab Emirates,Premium Dark Chocolate Bar (1 unit) for $3.84,This chocolate is incredibly smooth and satisfying. A delightful treat for its price.,positive,0.7,low,premium,low,5
8,0.49,Poland,Fresh Garden Tomatoes (8 units) at $0.49 each,Bought 8 tomatoes; they were fresh and juicy. Excellent quality for only $0.49 each.,positive,0.75,low,budget_conscious,low,5
12,0.75,United Kingdom,Sparkling Water Can (12 units) at $0.75 each,These sparkling water cans are refreshing. The price of $0.75 per can is a good deal.,positive,0.6,low,budget_conscious,low,4
7,3.56,Poland,Artisan Bread Loaves (7 units) at $3.56 each,The artisan bread is delicious and fresh. I bought 7 loaves; definitely worth the $3.56 price.,positive,0.7,low,budget_conscious,low,5
17,8.34,Portugal,Protein Bars (17-pack) for $8.34,I love these protein bars! The 17-pack for $8.34 is an unbeatable deal. Very filling.,positive,0.9,low,bulk_buyer,low,5
8,7.88,France,Premium Olive Oil (8 bottles) at $7.88 per bottle,This olive oil is high quality. I purchased 8 bottles and am very happy with the $7.88 price.,positive,0.75,low,premium,low,5
12,6.74,Germany,Organic Chicken Breast (12 lbs) at $6.74 per lb,The chicken breast was fresh and tender. Got 12 lbs for a fantastic price of $6.74/lb.,positive,0.8,low,bulk_buyer,low,5
98,5.79,Malta,Bulk Pasta (98 bags) at $5.79 per bag,Unbelievable deal on bulk pasta! 98 bags for $5.79 each is a steal. Stocked up for months.,positive,0.95,low,bulk_buyer,low,5
-3,8.14,Italy,Returned: Premium Steak Cuts (3 units) for $8.14 each,I returned 3 steak cuts due to quality issues. The refund process for $8.14 was smooth.,negative,-0.5,high,return_prone,medium,2
17,2.03,RSA,Eco-Friendly Dish Soap (17 bottles) at $2.03 each,This dish soap works great and is eco-friendly. I bought 17 bottles at an amazing $2.03 each.,positive,0.85,low,bulk_buyer,low,5
11,0.35,United Kingdom,Fresh Avocados (11 units) at $0.35 per unit,The avocados were perfectly ripe! I grabbed 11 of them for just $0.35 each. What a bargain!,positive,0.8,low,budget_conscious,low,5
13,17.87,Portugal,High-End Wine Bottles (13 units) at $17.87 each,These wine bottles are a fantastic gift. Purchased 13 for a special occasion at $17.87 each.,positive,0.7,low,premium,low,5
16,0.0,United Kingdom,Promotional Samples (16 units) for $0.00 each,Got 16 free promotional samples. It's always nice to get something for $0.00. Thanks!,positive,0.6,low,budget_conscious,low,4
3,3.06,Belgium,Gourmet Cheese Blocks (3 units) at $3.06 each,"The gourmet cheese was delicious. I only bought 3, but for $3.06 each, it's a great price.",positive,0.65,low,premium,low,4
14,8.95,Greece,Premium Frozen Seafood (14 packs) at $8.95 per pack,"The frozen seafood quality is top-notch. Bought 14 packs for $8.95 each, very satisfied.",positive,0.8,low,premium,low,5
10,4.97,Portugal,Organic Yogurt Cups (10 units) at $4.97 per cup,My kids love this organic yogurt. Stocked up with 10 cups at $4.97 each. A bit pricey but good.,positive,0.4,medium,bulk_buyer,medium,4
-1,4.18,Unspecified,Refunded: Specialty Tea Box (1 unit) for $4.18,Had to return one specialty tea box. The refund for $4.18 was processed quickly and easily.,negative,-0.2,high,return_prone,medium,2
4,2.44,United Arab Emirates,Assorted Snack Packs (4 units) at $2.44 each,These snack packs are perfect for lunchboxes. Got 4 of them for a reasonable $2.44 each.,positive,0.6,low,budget_conscious,low,4
4,17.17,Spain,Luxury Skincare Serum (4 bottles) at $17.17 per bottle,"This serum is amazing, my skin feels great. Purchased 4 bottles at $17.17 each, a splurge but worth it.",positive,0.75,low,premium,low,5
2,4.51,United Arab Emirates,"Gourmet Dark Chocolate Bars (2 units), $4.51 each",These dark chocolate bars are rich and delicious. A perfect treat! Great quality for $4.51 per bar.,positive,0.9,low,premium,low,5
41,0.95,Belgium,"Colorful Gel Pens (41 units), purchased at $0.95 each","Amazing deal on these pens! They write smoothly and come in vibrant colors. Highly recommend, especially at $0.95 each.",positive,0.9,low,budget_conscious,low,5
14,3.03,Cyprus,"Reusable Canvas Shopping Bags (14 units), $3.03 each",Love these bags! Very sturdy and perfect for groceries. The price of $3.03 per bag for 14 was a steal.,positive,0.95,low,budget_conscious,low,5
80,0.94,Switzerland,"Premium Disposable Face Masks (80 units), $0.94 each","Excellent quality masks for daily use. Comfortable and breathable, and a great price at $0.94 each for 80 units.",positive,0.9,low,bulk_buyer,low,5
6,7.42,Sweden,"Artisan Scented Candles (6 units), priced at $7.42 each",Beautiful candles with long-lasting scents. Perfect for creating a relaxing ambiance. A bit pricey but worth it at $7.42.,positive,0.7,low,premium,low,4
7,8.14,United Kingdom,"Organic Herbal Tea Blends (7 packs), $8.14 per pack","Delicious and soothing teas. Each pack offers a unique flavor. At $8.14 per pack, it's a luxury treat for 7 packs.",positive,0.85,low,premium,low,5
14,2.1,Sweden,"Durable Microfiber Cleaning Cloths (14 units), $2.10 each","These cleaning cloths are fantastic! Super absorbent and leave no streaks. Great value for $2.10 each, 14 purchased.",positive,0.9,low,budget_conscious,low,5
138,5.17,Greece,"Custom Printed T-Shirts (138 units), at $5.17 per shirt",The custom T-shirts arrived quickly and the print quality is superb. Very happy with this large order of 138 at $5.17/shirt!,positive,0.95,low,bulk_buyer,low,5
8,1.94,Switzerland,"Stainless Steel Straws with Cleaner (8 units), $1.94 each",Eco-friendly and well-made straws. Easy to clean and perfect for everyday use. Good price for 8 units at $1.94 each.,positive,0.85,low,budget_conscious,low,5
14,1.48,Netherlands,"Assorted Greeting Cards & Envelopes (14 cards), $1.48 each",Lovely designs and good card stock. A great selection for various occasions. Excellent value at $1.48 per card.,positive,0.9,low,budget_conscious,low,5
7,8.28,EIRE,"Premium Skincare Serum (7 bottles), priced at $8.28 each",This serum has done wonders for my skin! My complexion looks much brighter and smoother. A bit expensive but effective.,positive,0.75,low,premium,low,4
8,8.18,Channel Islands,"Gourmet Spice Blends (8 jars), purchased for $8.18 each",Fantastic selection of spices! Each blend is incredibly flavorful. Makes cooking so much more exciting. Worth the $8.18 per jar.,positive,0.9,low,premium,low,5
2,5.82,Channel Islands,"Premium Desk Organizers (2 units), purchased at $5.82 each",These desk organizers are very practical and stylish. They keep my workspace tidy. A good buy for the price of $5.82 each.,positive,0.8,low,budget_conscious,low,4
11,9.46,Netherlands,"Bestselling Fiction Novels (11 books), $9.46 per book",An amazing book collection! Each novel is captivating and well-written. A fantastic deal for 11 books at $9.46 each.,positive,0.95,low,budget_conscious,low,5
2,2.01,Netherlands,"Ultra-Soft Bath Towels (2 units), priced at $2.01 each",These towels are incredibly soft and absorbent. Perfect for daily use. Great quality for such a low price of $2.01 each.,positive,0.95,low,budget_conscious,low,5
13,9.92,EIRE,"High-Quality Kitchen Utensils (13 pieces), $9.92 each",These kitchen utensils are sturdy and well-designed. They cover all my cooking needs. Very pleased with the value at $9.92 per piece.,positive,0.9,low,budget_conscious,low,5
11,3.92,EIRE,"Durable Garden Gloves (11 pairs), purchased at $3.92 each",These garden gloves are comfortable and protect my hands well. Essential for any gardener. Good price for 11 pairs at $3.92 each.,positive,0.85,low,budget_conscious,low,5
9,2.03,Germany,"Assorted Craft Paints (9 tubes), priced at $2.03 each",Vibrant colors and good consistency. Perfect for my art projects. Very affordable set of 9 paints at $2.03 per tube.,positive,0.9,low,budget_conscious,low,5
8,2.19,Belgium,"Long-Lasting LED Light Bulbs (8 units), $2.19 each",These LED bulbs are bright and energy-efficient. A great upgrade for any home. Good value for 8 units at $2.19 per bulb.,positive,0.85,low,budget_conscious,low,5
10,9.29,Portugal,"Premium Espresso Capsules (10 packs), $9.29 per pack",These espresso capsules deliver a rich and robust flavor. Perfect for my morning brew. Great value for 10 packs at $9.29 each.,positive,0.9,low,premium,low,5
8,10.33,Channel Islands,"Premium Arabica Coffee Beans, 8 bags","These 8 bags of premium coffee beans at $10.33 each are fantastic. Rich flavor and aroma, highly recommend!",positive,0.9,low,premium,low,5
11,2.27,Belgium,"Organic Green Tea Bags, 11 count","Bought 11 boxes of organic green tea, each for $2.27. Great value and refreshing taste. Will repurchase.",positive,0.8,low,bulk_buyer,low,5
13,3.9,Portugal,"Artisan Sourdough Bread Loaves, 13 pieces",The 13 artisan bread loaves at $3.90 each were fresh and delicious. Perfect for sandwiches and toast.,positive,0.85,low,premium,low,5
4,5.78,Lithuania,"Gourmet Cheese Selection, 4 assorted packs","Picked up 4 packs of gourmet cheese for $5.78 each. Excellent quality and variety, perfect for a platter.",positive,0.85,low,premium,low,5
130,1.77,Austria,"Bulk Pack Ultra Absorbent Paper Towels, 130 rolls",Amazing deal on 130 rolls of paper towels at $1.77 per roll. Super absorbent and a household essential.,positive,0.9,low,bulk_buyer,low,5
12,1.04,Malta,"Natural Mineral Sparkling Water, 12-pack",The 12-pack of sparkling water at $1.04 per bottle is a great everyday purchase. Refreshing and crisp.,positive,0.8,low,bulk_buyer,low,5
8,2.51,Australia,"Fresh Fuji Apples, 8 lbs for baking","Bought 8 lbs of fresh apples at $2.51 per pound. They were crisp and sweet, perfect for snacking.",positive,0.85,low,premium,low,5
7,2.75,EIRE,"Canned Diced Tomato Sauce, 7 cans","These 7 cans of tomato sauce, costing $2.75 each, are excellent for cooking. Rich and flavorful base.",positive,0.8,low,bulk_buyer,low,5
4,1.86,Denmark,"Healthy Snack Bars Variety Pack, 4 boxes",The 4 boxes of snack bars for $1.86 each were a hit. Good for on-the-go energy. Kids loved them.,positive,0.85,low,bulk_buyer,low,5
3,3.16,Austria,"Extra Virgin Olive Oil, 3 large bottles",Got 3 bottles of this premium olive oil at $3.16 each. It has a wonderful taste and quality.,positive,0.85,low,premium,low,5
-1,10.22,Unspecified,Returned: High-Performance Deluxe Blender,I returned one deluxe blender for $10.22. It didn't meet my expectations for power. The return was smooth.,negative,-0.4,high,return_prone,medium,1
4,4.75,Austria,"Concentrated Laundry Detergent Pods, 4 packs",These 4 packs of laundry pods for $4.75 each are very effective. Clothes come out clean and fresh.,positive,0.8,low,bulk_buyer,low,5
2,5.91,Germany,"Italian Specialty Pasta Shapes, 2 boxes",Two boxes of specialty pasta at $5.91 each were a nice treat. Great texture and held sauce well.,positive,0.75,low,premium,low,4
9,6.15,Lithuania,"Frozen Organic Mixed Berries, 9 bags","Stocked up on 9 bags of organic berries at $6.15 each. Perfect for smoothies and desserts, always fresh.",positive,0.9,low,bulk_buyer,low,5
21,2.35,Austria,"Premium Bottled Spring Water, 21-pack",The 21-pack of spring water for $2.35 per bottle is a great value. Always good to have on hand.,positive,0.8,low,bulk_buyer,low,5
12,2.34,Cyprus,"Hearty Canned Soup Variety Pack, 12 cans",Bought 12 cans of soup for $2.34 each. Convenient for quick meals and has a decent flavor selection.,positive,0.6,low,bulk_buyer,low,4
18,2.24,Spain,"Dairy Fresh Whole Milk, 18 half-gallons",The 18 half-gallons of milk at $2.24 each are a staple. Always fresh and lasts well. Good for a large family.,positive,0.8,low,bulk_buyer,low,5
12,7.87,Greece,"Gourmet Frozen Pizza, 12 individual pizzas","These 12 premium frozen pizzas, each for $7.87, are surprisingly good. Quick dinner solution and tasty.",positive,0.8,low,premium,low,5
4,6.62,Iceland,"Dry Dog Food Kibble, 4 large bags for pets",My dog loves this kibble! Got 4 large bags for $6.62 each. Great ingredients and keeps him healthy.,positive,0.9,low,bulk_buyer,low,5
2,0.28,France,"Classic Milk Chocolate Candy Bar, 2 pieces","Just two small candy bars for $0.28 each. A tiny treat, but it hit the spot. Great low price.",positive,0.7,low,impulse_buyer,low,4
2,5.67,RSA,Organic Whole Wheat Bread Loaf (2 units) for $5.67,"Bought 2 loaves of this bread. Excellent quality for $5.67! Fresh, delicious, and great value. Will definitely repurchase.",positive,0.9,low,premium,low,5
7,3.06,Austria,Premium Dark Chocolate Bar (7 bars) at $3.06 each,"Ordered 7 bars of dark chocolate. Each was $3.06, a good deal. Rich flavor, perfect for my evening snack. Very satisfied.",positive,0.8,low,premium,low,5
10,12.56,Germany,Stainless Steel Water Bottle (10 units) at $12.56 each,"Received 10 water bottles, each costing $12.56. They are sturdy and well-made. Great for team gifts. Highly recommend for durability.",positive,0.85,low,bulk_buyer,low,5
34,1.93,Austria,Bulk Pack Microfiber Cleaning Cloths (34 units) for $1.93 each,Got 34 microfiber cloths at $1.93 each. They work wonders! Super absorbent and lint-free. An absolute steal for this quantity.,positive,0.9,low,bulk_buyer,low,5
9,2.56,Cyprus,Assorted Gourmet Coffee Pods (9 boxes) at $2.56 per box,"Purchased 9 boxes of coffee pods, each $2.56. The variety is great, and the taste is fantastic. A morning essential, very pleased.",positive,0.8,low,premium,low,5
19,0.42,France,Colorful Ballpoint Pen Set (19 pens) at an amazing $0.42 each,"Received 19 pens, only $0.42 each. They write smoothly and are comfortable to hold. Excellent bulk purchase for the office.",positive,0.85,low,bulk_buyer,low,5
5,3.66,Denmark,Handmade Scented Soap Bar (5 units) priced at $3.66 each,"Bought 5 bars of soap, $3.66 each. They smell wonderful and lather well. My skin feels soft and refreshed. Great value.",positive,0.8,low,premium,low,5
91,1.76,RSA,Disposable Face Masks (91 count box) priced at $1.76 per mask,"Ordered 91 face masks, each for $1.76. They are comfortable and breathable. Essential for daily use. Very happy with this bulk order.",positive,0.8,low,bulk_buyer,low,5
12,1.29,United Kingdom,AA Alkaline Batteries (12-pack) for just $1.29 per pack,"Got 12 packs of AA batteries, $1.29 each. They last a long time in my devices. Always good to have spares. Fantastic price!",positive,0.85,low,bulk_buyer,low,5
-2,6.46,Australia,Return: Premium Dog Food (2 bags) originally $6.46 each,"Returned 2 bags of dog food, each was $6.46. My dog didn't like the new flavor. Return process was smooth and hassle-free.",negative,-0.4,medium,return_prone,medium,2
54,1.71,EIRE,Heavy Duty Kitchen Sponges (54-count) at $1.71 per sponge,"Purchased 54 kitchen sponges, each for $1.71. They are very durable and clean effectively. Stocked up for months! Great bulk deal.",positive,0.85,low,bulk_buyer,low,5
2,14.93,United Kingdom,Adjustable LED Desk Lamp (2 units) priced at $14.93 each,"Got 2 LED desk lamps, $14.93 each. They provide good light and are very flexible. Perfect for reading or working. Excellent value.",positive,0.8,low,budget_conscious,low,5
9,2.67,United Arab Emirates,Organic Green Tea Bags (9 boxes) at $2.67 per box,"Ordered 9 boxes of green tea, $2.67 each. The tea is fresh and has a mild, pleasant taste. A relaxing drink after a long day.",positive,0.75,low,premium,low,4
40,4.99,Lithuania,Premium Glossy Photo Paper (40 packs) for $4.99 each,"Ordered 40 packs of photo paper, $4.99 each. The prints are vibrant and professional. Fantastic quality for bulk printing.",positive,0.9,low,bulk_buyer,low,5
14,1.26,Switzerland,Colorful Craft Yarn Skeins (14 units) at $1.26 each,"Bought 14 skeins of yarn, $1.26 each. The colors are beautiful and the yarn is soft. Perfect for my knitting projects. Very happy.",positive,0.8,low,bulk_buyer,low,5
39,6.86,Poland,Large Reusable Shopping Bags (39 units) for $6.86 each,"Purchased 39 reusable bags, $6.86 apiece. They are very sturdy and hold a lot. Environmentally friendly and a great investment.",positive,0.85,low,bulk_buyer,low,5
15,7.07,Cyprus,Artisan Ceramic Coffee Mugs (15 units) priced at $7.07 each,"Got 15 ceramic mugs, $7.07 each. Beautiful design and good quality. Perfect for my cafe. Customers love them. Quick delivery too.",positive,0.9,low,bulk_buyer,low,5
6,1.77,RSA,Fruit-Flavored Lip Balm Set (6 balms) for just $1.77 each,"Ordered 6 lip balms, $1.77 each. They smell great and keep my lips moisturized. A small treat that makes a big difference.",positive,0.75,low,budget_conscious,low,4
8,10.04,United Kingdom,Bluetooth Wireless Earbuds (8 pairs) at $10.04 per pair,"Bought 8 pairs of earbuds, $10.04 each. Sound quality is surprisingly good for the price. Great for gifts or personal use.",positive,0.7,low,budget_conscious,low,4
57,6.11,Channel Islands,Premium Quality Bath Towels (57 units) at $6.11 each,"Purchased 57 bath towels, each for $6.11. They are soft, absorbent, and well-made. Excellent value for such a large quantity.",positive,0.85,low,bulk_buyer,low,5
17,5.15,USA,"Premium Coffee Blend - 17 bags, priced at $5.15 each.","Absolutely love this coffee! The 17 bags arrived quickly, and the $5.15 price per bag was a great deal. Will buy again!",positive,0.9,low,bulk_buyer,low,5
4,9.04,Germany,"Organic Green Tea - 4 boxes, each for $9.04.","Good quality green tea. I bought 4 boxes for $9.04 each. It's a bit pricey, but worth it for the organic certification.",positive,0.6,low,premium,low,4
8,3.93,Italy,"Artisan Bread Loaf - 8 units, at $3.93/loaf.",Fresh and delicious bread. Picked up 8 loaves for family dinner. The $3.93 price is reasonable. Very satisfied.,positive,0.8,low,bulk_buyer,low,5
8,0.53,Malta,"Small Paper Clips - 8 packs, only $0.53 each.","These paper clips are super affordable! Got 8 packs for just $0.53 each. Perfect for office use, great value.",positive,0.8,low,budget_conscious,low,5
1,5.57,Poland,"Premium Chocolate Bar - 1 unit, costs $5.57.","Indulgent and rich chocolate. Only bought one for $5.57, but it was a delightful treat. High quality, worth the splurge.",positive,0.9,low,impulse_buyer,low,5
9,9.36,France,"Stainless Steel Water Bottle - 9 units, $9.36/item.",These water bottles are fantastic! Ordered 9 for the team at $9.36 each. They keep drinks cold all day. Highly recommend them.,positive,0.9,low,bulk_buyer,low,5
1,6.57,Channel Islands,"Handmade Ceramic Mug - 1 piece, priced at $6.57.","Beautiful craftsmanship on this mug! I only got one for $6.57, but it feels sturdy and looks great. A lovely addition to my kitchen.",positive,0.8,low,premium,low,5
7,2.62,Germany,"Organic Apple Snacks - 7 bags, each for $2.62.",My kids love these apple snacks! Bought 7 bags at $2.62 each. A healthy and convenient option for school lunches. Excellent.,positive,0.9,low,bulk_buyer,low,5
45,11.81,Italy,"Bulk Laundry Detergent - 45 units, $11.81 per box.",Fantastic deal on laundry detergent! Purchased 45 boxes for $11.81 each. It cleans well and the bulk price is unbeatable.,positive,0.9,low,bulk_buyer,low,5
15,1.54,France,"Colorful Ballpoint Pens - 15 packs, only $1.54 each.",Great pens for everyday use. Got 15 packs for $1.54 each. They write smoothly and the colors are vibrant. Very happy.,positive,0.8,low,bulk_buyer,low,5
