Quantity,Price,Country,Description,Review,sentiment,sentiment_score,risk_level,customer_segment,churn_risk,satisfaction_score
13,1.72,EIRE,"13 units of Classic Ballpoint Pen, only $1.72 each!","Bought 13 pens for school, they write smoothly and the $1.72 price per unit is unbeatable. Great value!",positive,0.85,low,budget_conscious,low,5
5,6.93,Spain,"Premium Organic Coffee Beans, 5 bags at $6.93/bag.",The 5 bags of coffee arrived quickly. The $6.93 price per bag is fair for such quality. Will reorder!,positive,0.75,low,premium,low,5
-5,6.67,Italy,"Refund for 5 boxes of gourmet chocolates, $6.67/box.","Returned 5 boxes of chocolates. Customer service was excellent, processed refund for $6.67 each swiftly.",neutral,0.0,high,return_prone,medium,3
2,3.26,United Kingdom,"Stylish Ceramic Mug, a pair for just $3.26 each.",Got 2 mugs as a gift. They are sturdy and the $3.26 price for each is a steal. Very happy with this purchase.,positive,0.8,low,budget_conscious,low,5
17,12.6,Greece,"High-Performance Wireless Mouse, 17 units at $12.60.",Purchased 17 mice for the office. They work flawlessly. The $12.60 unit price is good for bulk. Recommended!,positive,0.85,low,bulk_buyer,low,5
17,1.56,Switzerland,"Pack of 17 durable plastic hangers, only $1.56 each.","Needed many hangers, these 17 are perfect. At $1.56 each, they're a great deal. Sturdy and space-saving.",positive,0.8,low,bulk_buyer,low,5
3,5.8,United Kingdom,"Set of 3 premium kitchen towels, priced at $5.80 each.","Received 3 kitchen towels, very absorbent. The $5.80 price per towel is reasonable for the quality. Love them!",positive,0.75,low,premium,low,5
9,9.84,United Kingdom,"9-pack of Ultra-Soft Bath Bombs, just $9.84 per bomb.","The 9 bath bombs are amazing! The $9.84 price for each is a bit high, but they smell fantastic and relax me.",positive,0.6,low,premium,low,4
12,2.12,Cyprus,"12-pack of AA Alkaline Batteries, only $2.12 per pack.",Bought 12 packs of batteries. They last long and the $2.12 price per pack is very competitive. Good buy!,positive,0.8,low,bulk_buyer,low,5
0,1.58,Norway,"Zero quantity order for a Cute Animal Sticker, $1.58.","My order for a sticker at $1.58 showed 0 quantity, likely a system error or cancelled item. No item received.",negative,-0.8,high,impulse_buyer,high,1
12,7.43,Belgium,"12-Piece Stainless Steel Cutlery Set, $7.43 per piece.",The 12 cutlery pieces feel solid and look great. $7.43 per piece is a good price for such quality. Highly recommend.,positive,0.8,low,bulk_buyer,low,5
11,4.38,Greece,"11 vibrant colored pencils, perfect for artists, $4.38.",Got 11 pencils for my art class. The colors are great and the $4.38 price is fair. Very happy with them!,positive,0.7,low,bulk_buyer,low,5
11,5.84,Lithuania,"Set of 11 durable food storage containers, $5.84 each.","These 11 containers are fantastic for meal prep! The $5.84 price per unit is a bit much, but they are sturdy.",positive,0.6,low,bulk_buyer,low,4
4,0.71,United Kingdom,"4 Miniatures Succulent Plants, a bargain at $0.71 each.","Ordered 4 tiny succulents. They arrived healthy! At just $0.71 each, they are an absolute steal. So cute!",positive,0.9,low,budget_conscious,low,5
5,9.79,France,"5 books of best-selling mystery novels, $9.79 per book.",Received 5 mystery novels. Great reads! The $9.79 price for each book is reasonable for new releases. Enjoying them.,positive,0.7,low,premium,low,5
4,9.54,Norway,"4 high-quality scented candles, perfect gift, $9.54 each.",The 4 candles smell divine! $9.54 per candle is a good price for this brand. They burn evenly and fill the room.,positive,0.8,low,premium,low,5
43,1.49,Germany,"Bulk order of 43 durable plastic forks, only $1.49 each.","Bought 43 forks for a party. They're strong enough and at $1.49 each, it was a very economical purchase. Good value.",positive,0.7,low,bulk_buyer,low,5
19,8.28,Belgium,"19 sets of premium art brushes for professionals, $8.28.",The 19 brush sets are fantastic quality! $8.28 per set is a fair price for professional tools. Highly satisfied.,positive,0.9,low,bulk_buyer,low,5
15,1.62,Germany,"15 rolls of colorful decorative tape, just $1.62 per roll.",Needed 15 tape rolls for crafts. The colors are vibrant and the $1.62 price per roll is excellent. Kids love them!,positive,0.8,low,bulk_buyer,low,5
7,3.16,Australia,"7-pack of refreshing facial masks, great value at $3.16.","The 7 facial masks are so refreshing! At $3.16 each, they are a luxurious treat without breaking the bank. My skin feels great.",positive,0.9,low,budget_conscious,low,5
-1,10.85,Channel Islands,"Premium Organic Coffee Beans, 1lb Bag","Had to return 1 bag of coffee for $10.85. The flavor was just not what I expected, a bit too bitter for my taste.",negative,-0.7,high,return_prone,high,1
15,5.89,Germany,"Stainless Steel Water Bottle, 20oz",Bought 15 water bottles at $5.89 each for our team. Great quality and perfect for everyday use. Very satisfied!,positive,0.9,low,bulk_buyer,low,5
10,0.8,Austria,"Colorful Gel Pens, Pack of 5",Amazing value! Got 10 packs of these gel pens for only $0.80 each. They write smoothly and the colors are vibrant.,positive,0.8,low,budget_conscious,low,5
35,2.53,Germany,"Bulk Pack AAA Batteries, 100 Count",Ordered 35 units of batteries at $2.53 per unit. Always need these. Good price and they last a decent amount of time.,positive,0.7,low,bulk_buyer,low,4
13,4.46,Malta,"Handmade Ceramic Mug, 12oz Capacity","Received 13 beautiful ceramic mugs, each costing $4.46. They arrived well-packaged and are perfect for my craft fair.",positive,0.8,low,bulk_buyer,low,5
-3,2.36,Belgium,Eco-Friendly Reusable Shopping Bag,Returned 3 shopping bags priced at $2.36 each. They were too small for my groceries. Process was quick and easy.,negative,-0.4,high,return_prone,medium,2
10,9.08,Portugal,High-Quality Bluetooth Earbuds,Purchased 10 pairs of earbuds for $9.08 each. Sound quality is impressive for the price. Very happy with this bulk buy.,positive,0.9,low,bulk_buyer,low,5
6,1.97,Poland,"Organic Cotton Dish Towels, Set of 2",Got 6 sets of these dish towels at $1.97 per set. They are super absorbent and look great in my kitchen. Excellent value!,positive,0.8,low,budget_conscious,low,5
14,3.31,Portugal,"Assorted Scented Candles, 4-Pack",Ordered 14 packs of candles for $3.31 each. The scents are lovely and they burn evenly. Perfect for gifts.,positive,0.8,low,bulk_buyer,low,5
12,13.67,Germany,"Premium Wireless Mouse, Ergonomic","Received 12 ergonomic mice, priced at $13.67 each. They feel comfortable and respond well. A great deal for the office.",positive,0.8,low,bulk_buyer,low,5
3,5.3,United Kingdom,"Artisan Bread Mix, Gluten-Free",Bought 3 bags of this bread mix for $5.30 each. It makes delicious gluten-free bread. Will definitely repurchase!,positive,0.9,low,impulse_buyer,low,5
8,3.49,United Kingdom,"Heavy-Duty Packing Tape, 6 Rolls","Purchased 8 packs of packing tape at $3.49 per pack. It's strong and sticks well, perfect for moving. Highly recommend.",positive,0.9,low,bulk_buyer,low,5
7,2.15,Germany,Kids' Colorful Building Blocks Set,Got 7 sets of building blocks for $2.15 each. My grandkids love them! Bright colors and good quality plastic.,positive,0.8,low,impulse_buyer,low,5
0,3.31,United Kingdom,"Interactive Pet Toy for Cats, Fun Design","My order for this pet toy at $3.31 was cancelled due to zero stock. Disappointing, but I hope it comes back soon.",negative,-0.5,medium,impulse_buyer,medium,2
7,2.38,USA,"Reusable Produce Bags, Mesh Set",Bought 7 sets of mesh produce bags for $2.38 each. They are fantastic for groceries and very durable. Eco-friendly choice!,positive,0.9,low,budget_conscious,low,5
9,13.02,Germany,"Smart Home LED Light Bulbs, Dimmable",Invested in 9 smart light bulbs at $13.02 each. Easy to set up and control with my phone. Bright and energy efficient.,positive,0.8,low,premium,low,5
0,11.88,Spain,Premium Stainless Steel Frying Pan,"Wanted this frying pan for $11.88, but it was out of stock (quantity 0). Still waiting for it to be available again.",neutral,-0.2,medium,premium,medium,3
97,5.45,EIRE,Bulk Pack Microfiber Cleaning Cloths,Ordered 97 cleaning cloths for $5.45 each. They are incredibly effective and absorb well. A fantastic bulk purchase!,positive,0.9,low,bulk_buyer,low,5
15,5.43,Malta,Children's Picture Book Collection,Purchased 15 picture books at $5.43 each for a school donation. The stories are engaging and illustrations are lovely.,positive,0.8,low,bulk_buyer,low,5
14,1.33,Greece,"Small Potted Succulent Plant, Easy Care",Got 14 succulent plants for $1.33 each. They are adorable and arrived in perfect condition. Great for little gifts.,positive,0.9,low,bulk_buyer,low,5
24,9.82,Austria,Premium Organic Coffee Beans 1lb Bag,"Bought 24 bags for $9.82 each. Excellent flavor, very fresh. A great deal for bulk purchase. Highly recommend it!",positive,0.9,low,bulk_buyer,low,5
1,3.71,Germany,Durable Stainless Steel Bottle Opener,"Just one at $3.71. Simple, effective, and sturdy. Does exactly what it should. Good value for a basic tool.",positive,0.7,low,budget_conscious,low,4
133,3.36,EIRE,Bulk Pack of AA Alkaline Batteries,Ordered 133 batteries at $3.36 each. Perfect for office needs. Long-lasting and reliable. Great bulk buy.,positive,0.9,low,bulk_buyer,low,5
10,2.67,Netherlands,"Colorful Gel Pen Set, 10 Count",Got 10 sets for $2.67 each. The colors are vibrant and they write smoothly. Great for journaling and art projects. Kids love them!,positive,0.8,low,budget_conscious,low,5
14,9.46,Australia,"Ergonomic Office Mouse, Wireless",Purchased 14 of these at $9.46 each for the team. Very comfortable to use all day. Good precision and battery life.,positive,0.8,low,bulk_buyer,low,4
25,2.21,Switzerland,"Soft Microfiber Cleaning Cloths, 5pk",Bought 25 packs at $2.21 each. These cloths are amazing! Super absorbent and leave no streaks. Fantastic for household cleaning.,positive,0.9,low,bulk_buyer,low,5
7,2.06,United Arab Emirates,"Assorted Scented Candles, Small Jar",Got 7 candles for $2.06 each. They smell wonderful and burn evenly. Perfect for creating a cozy atmosphere at home.,positive,0.8,low,budget_conscious,low,5
3,3.92,Portugal,Organic Whole Wheat Bread Loaf,"Picked up 3 loaves at $3.92 each. Fresh, delicious, and healthy. A staple in our kitchen. Will definitely buy again.",positive,0.9,low,premium,low,5
9,2.94,Cyprus,"Hand Sanitizer with Aloe, 8oz Bottle","Ordered 9 bottles for $2.94 apiece. Perfect for keeping hands clean on the go. Doesn't dry out skin, which is a plus.",positive,0.8,low,budget_conscious,low,4
7,3.69,Bahrain,"Dark Chocolate Bar, 70% Cacao",Bought 7 bars at $3.69 each. Rich and not too sweet. A perfect treat for dark chocolate lovers. Highly recommend this brand.,positive,0.9,low,premium,low,5
16,0.59,Switzerland,"Standard Yellow #2 Pencils, Dozen Pack",Purchased 16 packs at a great price of $0.59 each. Essential for school supplies. Good quality and write smoothly. Excellent value!,positive,0.9,low,bulk_buyer,low,5
11,1.95,Portugal,"Disposable Face Masks, 50-count Box","Received 11 boxes for $1.95 each. Good quality masks, comfortable and breathable. Essential for daily use. Very happy with the purchase.",positive,0.8,low,bulk_buyer,low,4
13,7.99,Portugal,High-Speed USB 3.0 Flash Drive 64GB,Got 13 drives at $7.99 apiece. Fast data transfer and reliable storage. Great for backups and sharing files. Fantastic deal for the capacity.,positive,0.9,low,bulk_buyer,low,5
12,1.75,Greece,Multi-Purpose Adhesive Tape Rolls,Bought 12 rolls for $1.75 each. Strong adhesive and easy to tear. Perfect for crafts and general household use. A very handy item.,positive,0.8,low,bulk_buyer,low,4
52,14.85,Belgium,"Gourmet Olive Oil, Extra Virgin 1 Liter",Ordered 52 bottles at $14.85 each. Exceptional quality olive oil. Perfect for cooking and dressings. The flavor is robust and authentic.,positive,0.95,low,premium,low,5
21,8.02,Greece,"Classic White T-Shirts, Men's Large","Purchased 21 shirts for $8.02 each. Soft cotton, good fit, and durable. They hold up well after multiple washes. Excellent everyday wear.",positive,0.8,low,bulk_buyer,low,5
5,5.81,Greece,"Natural Deodorant Stick, Unscented",Bought 5 sticks at $5.81 each. Works great without irritation. A good natural alternative. Keeps me feeling fresh all day.,positive,0.8,low,premium,low,4
6,5.25,United Kingdom,"Kids' Art Activity Book Set, 3-pack",Got 6 sets for $5.25 each. Provides hours of creative fun for the kids. Great variety of activities. Good value for entertainment.,positive,0.8,low,budget_conscious,low,4
3,14.88,Greece,Premium Noise-Cancelling Headphones,Purchased 3 pairs at $14.88 each. Sound quality is impressive and noise cancellation works well. Comfortable for long listening sessions.,positive,0.9,low,premium,low,5
29,15.75,United Kingdom,"Heavy-Duty Garden Gloves, Large Size",Ordered 29 pairs at $15.75 each. Very durable and provide good protection for gardening tasks. Comfortable fit too. Highly recommend these.,positive,0.9,low,bulk_buyer,low,5
13,6.38,Austria,"Premium Coffee Beans, 13 bags, $6.38/bag",Excellent quality coffee for the price! Received all 13 bags as ordered. Will definitely repurchase again.,positive,0.9,low,bulk_buyer,low,5
8,6.78,USA,"Organic Green Tea, 8 packs, $6.78 each","The green tea is quite refreshing. Good value for 8 packs, though shipping was a bit slow.",positive,0.6,medium,bulk_buyer,medium,4
9,9.77,RSA,"Luxury Scented Candles, 9 units, $9.77/unit",These candles smell amazing and burn evenly. A bit pricey but worth it for the quality. Very happy with all 9.,positive,0.8,low,premium,low,5
7,6.7,Australia,"Ergonomic Mouse Pad, 7 units, $6.70 per pad",Comfortable and well-made mouse pads. Ordered 7 and they arrived quickly. Good purchase for the home office.,positive,0.8,low,bulk_buyer,low,5
11,5.62,Lithuania,"Stainless Steel Water Bottles, 11-pack, $5.62/bottle","Great water bottles, perfect for daily use. All 11 arrived in perfect condition. Excellent deal!",positive,0.9,low,bulk_buyer,low,5
9,2.5,Cyprus,"Colorful Gel Pens Set, 9 packs, $2.50 each",These gel pens write smoothly and have vibrant colors. Fantastic price for 9 packs. Kids love them!,positive,0.9,low,bulk_buyer,low,5
14,10.55,United Arab Emirates,"Professional Art Brush Set, 14 brushes, $10.55/brush","High-quality brushes for serious artists. A bit expensive, but the 14 brushes are worth every penny.",positive,0.8,low,premium,low,5
5,9.81,Cyprus,"Gourmet Dark Chocolate Bar, 5 bars, $9.81 each",Rich and delicious dark chocolate. Bought 5 as gifts and everyone loved them. A bit indulgent but worth it.,positive,0.8,low,premium,low,5
4,1.2,Lithuania,"Disposable Face Masks, 4 boxes, $1.20 per box","Basic masks, good for everyday use. Very affordable at $1.20 a box. Received all 4 boxes promptly.",positive,0.7,low,budget_conscious,low,4
20,2.85,United Kingdom,"USB-C Charging Cables, 20-pack, $2.85 per cable",You can't beat this price for 20 durable USB-C cables. They charge fast and seem well-made. Impressed!,positive,0.9,low,bulk_buyer,low,5
14,3.44,USA,"Assorted Snack Bars, 14-count box, $3.44/bar",Delicious and healthy snack bars. Great variety in the 14-count box. A staple in my pantry now.,positive,0.9,low,bulk_buyer,low,5
4,2.04,Denmark,"Portable Hand Sanitizer, 4 bottles, $2.04 each",Perfect size for on-the-go. The scent is mild and it doesn't dry out my hands. Got 4 bottles.,positive,0.8,low,bulk_buyer,low,5
0,9.74,Greece,"Rare Collectible Action Figure, 0 delivered, $9.74",Extremely disappointed. Item was listed but never shipped. My order of 0 was truly 0. Unacceptable!,negative,-1.0,high,return_prone,high,1
1,2.55,Germany,"Premium Microfiber Cloth, 1 piece, $2.55","Very soft and effective for cleaning. A bit expensive for just one cloth, but it does a great job.",positive,0.6,low,premium,low,4
11,1.71,Spain,"Heavy-Duty Packing Tape, 11 rolls, $1.71 per roll",This tape is strong and sticks well. Very good price for 11 rolls. Essential for moving or shipping.,positive,0.9,low,bulk_buyer,low,5
5,1.25,France,"Colorful Balloons Pack, 5 bags, $1.25 per bag",Great for parties! The colors are vibrant and they held air well. All 5 bags were perfect. Kids loved them.,positive,0.9,low,bulk_buyer,low,5
8,2.41,Cyprus,"Bulk AA Batteries, 8-pack, $2.41 per pack",Reliable batteries at a fantastic price. Ordered 8 packs and they arrived fully charged. Will buy again.,positive,0.9,low,bulk_buyer,low,5
9,7.15,Cyprus,"Organic Cotton T-Shirts, 9 units, $7.15 each","Soft and comfortable t-shirts. The fabric feels great. Good value for 9 shirts, though sizing runs a bit small.",positive,0.6,medium,bulk_buyer,medium,4
11,7.23,Portugal,"Durable Pet Chew Toys, 11 pieces, $7.23 each",My dog loves these! They're really tough and have lasted well. All 11 toys were a hit. Great investment.,positive,0.9,low,bulk_buyer,low,5
3,0.2,Netherlands,"Small Hair Clips, 3 packs, $0.20 per pack","Super cheap and practical hair clips. Perfect for everyday use. Got 3 packs, can't complain for the price!",positive,0.9,low,impulse_buyer,low,5
105,0.09,Netherlands,"Organic Fair-Trade Coffee Beans, 12oz Bag","Bought 17 bags of these beans for $7.01 each. The aroma is amazing, and the taste is rich and smooth. A morning essential, highly recommend!",positive,0.9,low,bulk_buyer,low,5
17,1.19,United Kingdom,Ergonomic Office Chair with Lumbar Support,This chair is fantastic! I spent $21.58 on it and it's worth every penny. My back pain has significantly improved. Assembly was a breeze.,positive,0.9,low,premium,low,5
1,3.17,Spain,"Premium Stainless Steel Water Bottle, 1L","I got 2 of these bottles. Perfect for the gym, keeps water cold all day. Great value for the price, especially at $3.35 each. Highly satisfied!",positive,0.8,low,budget_conscious,low,5
6,7.74,Unspecified,"Smart LED Light Bulb, Dimmable & Color-Changing",These bulbs are great! Bought 12 for my living room at $6.28 each. Easy to set up and the colors are vibrant. Very happy with this purchase.,positive,0.8,low,premium,low,5
20,4.88,France,Wireless Bluetooth Earbuds with Charging Case,"I bought 1 pair of these for $11.86. Sound quality is decent for the price. They stay in my ears during runs, which is a big plus!",positive,0.6,low,bulk_buyer,low,4
-5,3.1,Germany,"Non-Stick Ceramic Frying Pan, 10-inch","This pan is a game-changer! Cooked an omelette effortlessly. At $9.81, it's a steal. Definitely replacing all my old pans with these.",positive,0.9,high,return_prone,medium,5
11,8.25,Netherlands,Set of 4 Microfiber Cleaning Cloths,Excellent value! I purchased 105 of these for my business at $0.09 each. They are super absorbent and leave no streaks. Will buy again!,positive,0.9,low,bulk_buyer,low,5
12,7.01,EIRE,Natural Wood Coasters (Set of 6),These coasters are beautiful and functional. I paid $3.91 for 9 sets. They protect my table well. A simple yet elegant addition to my home.,positive,0.7,low,premium,low,4
2,3.35,United Kingdom,"Heavy-Duty Garden Gloves, Size Large",I bought 3 pairs of these gloves for $4.68 each. They're very durable and comfortable for gardening. My hands stayed clean and protected.,positive,0.7,low,budget_conscious,low,4
23,6.28,Belgium,"Portable Power Bank, 10000mAh",This power bank is a lifesaver! Charges my phone quickly. I got 13 of them for the whole family at $3.95 each. No more low battery anxiety!,positive,0.9,low,bulk_buyer,low,5
11,9.81,Switzerland,Aromatherapy Essential Oil Diffuser,Got 1 of these for $3.17. It works perfectly and fills the room with a lovely scent. The LED light feature is a nice touch. Highly recommend.,positive,0.9,low,bulk_buyer,low,5
9,3.91,United Kingdom,"Reusable Canvas Shopping Bag, Large",I purchased 14 of these bags for $2.29 each. They are sturdy and hold a lot. Perfect for grocery runs and reducing plastic waste. Love them!,positive,0.8,low,budget_conscious,low,5
25,5.86,Iceland,"Premium Quality Pet Food, 5lb Bag","My dog loves this food! He's been much more energetic. I bought 6 bags at $7.74 each. It's a bit pricey, but worth it for his health.",positive,0.9,low,premium,low,5
52,9.73,Belgium,"Yoga Mat with Carrying Strap, 6mm Thick",This yoga mat is comfortable and provides great grip. I bought 20 of them for my studio at $4.88 each. Excellent quality for the price.,positive,0.8,low,bulk_buyer,low,5
7,2.29,EIRE,"Assorted Gel Pens, Pack of 12",Great pens for journaling! The colors are vibrant and they write smoothly. I bought 11 packs for $8.25 each. Very satisfied with this purchase.,positive,0.8,low,budget_conscious,low,5
6,8.66,Netherlands,Digital Kitchen Scale with LCD Display,A must-have for baking! Very accurate and easy to use. I purchased 25 of these for $5.86 each. It has made my cooking much more precise.,positive,0.9,low,bulk_buyer,low,5
103,11.86,USA,"Stainless Steel Travel Mug, 16oz",Keeps my coffee hot for hours! I bought 52 of these for a company event at $9.73 each. Everyone loved them. Durable and spill-proof.,positive,0.9,low,bulk_buyer,low,5
3,4.68,Cyprus,"Organic Herbal Tea Bags, Variety Pack","Delicious and soothing teas! I got 7 boxes for $2.29 each. Great selection of flavors, perfect for winding down in the evening. Will repurchase.",positive,0.8,low,budget_conscious,low,5
13,3.95,France,"High-Speed USB-C Charging Cable, 6ft",These cables are fantastic! I bought 6 of them at $8.66 each. They charge my devices super fast and feel very durable. No more slow charging!,positive,0.9,low,bulk_buyer,low,5
14,21.58,Germany,"Luxury Bath Towel Set, 2-Piece",These towels are incredibly soft and absorbent. I bought 103 sets for $11.86 each. They feel luxurious and hold up well after washing. Excellent quality.,positive,0.9,low,bulk_buyer,low,5
-1,2.58,France,Refund for 1 unit of small candy bar,"Disappointed with this candy bar, returned it. Not worth the $2.58 I paid. Will try another brand next time.",negative,-0.8,high,return_prone,high,1
37,1.03,Netherlands,Bulk order of 37 pencils for office,Fantastic value for 37 pencils at $1.03 each. Perfect for stocking the office supply. Recommend!,positive,0.9,low,bulk_buyer,low,5
10,15.79,RSA,Premium set of 10 professional art markers,"These 10 art markers are amazing! Vibrant colors, blend beautifully. Pricey at $15.79 each, but quality is superb.",positive,0.85,low,premium,low,5
4,6.35,Germany,Pack of 4 durable kitchen sponges,These 4 kitchen sponges are fantastic! They hold up well to daily use and scrub effectively. Good value for $6.35.,positive,0.75,low,budget_conscious,low,5
2,2.96,Netherlands,Two convenient organic apple snack packs,Bought 2 snack packs for $2.96 each. Fresh and convenient for kids' lunches. Will buy again.,positive,0.7,low,impulse_buyer,low,4
28,14.56,Germany,Box of 28 high-quality ceramic tiles,"These 28 ceramic tiles arrived quickly and well-packaged. At $14.56 per tile, great for my renovation project. Pleased.",positive,0.8,low,bulk_buyer,low,5
21,7.53,France,Bundle of 21 colorful party balloons,"Got 21 balloons for a party, cost $7.53 each. Vibrant and lasted all day. Good purchase!",positive,0.75,low,bulk_buyer,low,5
9,4.59,EIRE,Set of 9 assorted craft glitter tubes,These 9 glitter tubes are perfect for my crafts. Fair price at $4.59. Kids love the variety of colors.,positive,0.7,low,budget_conscious,low,4
12,18.32,United Kingdom,12 high-performance LED light bulbs,"Ordered 12 LED bulbs at $18.32 each. Excellent illumination, energy-efficient. Worth the investment.",positive,0.9,low,premium,low,5
106,2.01,United Kingdom,Bulk purchase of 106 disposable cups,"Needed 106 disposable cups for a large event. At $2.01 each, they were sturdy and perfect. Good value.",positive,0.8,low,bulk_buyer,low,5
1,2.67,United Kingdom,Single premium organic coffee bean bag,"Just bought one bag of coffee for $2.67. Tastes fresh and rich, great morning start. Happy.",positive,0.8,low,premium,low,5
14,7.6,France,Pack of 14 durable reusable shopping bags,These 14 shopping bags are excellent! Very sturdy and hold a lot. Good price at $7.60 each. Great buy.,positive,0.9,low,budget_conscious,low,5
-1,3.24,United Arab Emirates,Return of 1 faulty USB charging cable,"USB cable stopped working after a week, had to return it. Not worth $3.24. Disappointed with quality.",negative,-0.9,high,return_prone,high,1
1,2.89,Spain,One premium quality microfiber cloth,"Got one microfiber cloth for $2.89. Super absorbent, great for cleaning. Very happy with this purchase.",positive,0.85,low,premium,low,5
11,7.36,Germany,Set of 11 assorted scented candles,These 11 scented candles smell wonderful and burn evenly. Good value at $7.36 each. Great for ambiance.,positive,0.8,low,budget_conscious,low,5
4,9.94,Italy,Pack of 4 durable garden hand tools,These 4 garden tools are quite sturdy for $9.94 each. They make gardening easier. Definitely a good buy.,positive,0.75,low,budget_conscious,low,5
8,6.5,EIRE,Set of 8 colorful children's art paints,Bought 8 paints for the kids at $6.50 each. Colors are vibrant and wash off easily. Perfect for play.,positive,0.75,low,impulse_buyer,low,4
-1,10.36,Italy,Refund for 1 defective smart home plug,"Smart plug stopped responding after a few days, had to return. Paid $10.36, but it wasn't reliable.",negative,-0.85,high,return_prone,high,1
31,2.53,EIRE,Bulk pack of 31 assorted craft paper sheets,"Ordered 31 sheets of craft paper at $2.53 each. Great quality, perfect for school projects. Satisfied.",positive,0.8,low,bulk_buyer,low,5
6,2.73,Germany,Pack of 6 eco-friendly bamboo toothbrushes,These 6 bamboo toothbrushes are great for $2.73 each. Eco-friendly and comfortable. Good choice!,positive,0.75,low,budget_conscious,low,5
15,1.83,United Arab Emirates,Bulk Pack of 15 Pencil Sets for School Supplies,"Bought 15 pencil sets at $1.83 each. Great value for school. Kids love them, they write smoothly. Highly recommend.",positive,0.9,low,bulk_buyer,low,5
5,5.21,Spain,"Premium Organic Green Tea Bags, 5-Count Box",These 5 green tea bags at $5.21 were a delightful treat. The flavor is rich and refreshing. Will definitely repurchase.,positive,0.95,low,premium,low,5
